{
  "$schema": "https://xnsteam-ai.github.io/Html-library/r/schema.json",
  "name": "image-smart-glasses-badge",
  "title": "Smart Glasses Badge",
  "description": "Close crop on a pair of smart glasses with a circular product badge overlay",
  "category": "images",
  "type": "html",
  "version": "0.1.0",
  "tailwind": "^4.0.0",
  "tags": [
    "product",
    "tech",
    "wearable",
    "badge"
  ],
  "files": [
    {
      "path": "image-smart-glasses-badge.html",
      "type": "html",
      "content": "<!--\n  Smart Glasses Badge — 928×1152 JPEG from the HTML Library image set.\n  The width/height attributes reserve the box so the page does not shift\n  while the file downloads.\n-->\n<figure class=\"mx-auto w-full max-w-2xl\">\n  <img\n    src=\"https://xnsteam-ai.github.io/Html-library/images/2026207647968743551-1.jpg\"\n    alt=\"Close crop on a pair of smart glasses with a circular product badge overlay\"\n    width=\"928\"\n    height=\"1152\"\n    class=\"h-auto w-full rounded-xl\"\n  />\n  <figcaption class=\"mt-2 text-[12px] text-gray-600 dark:text-gray-400\">Smart Glasses Badge · 928×1152</figcaption>\n</figure>\n"
    }
  ]
}
