{
  "$schema": "https://xnsteam-ai.github.io/Html-library/r/schema.json",
  "name": "image-plush-toy-set",
  "title": "Plush Toy Set",
  "description": "Four plush characters shot flat against clean backdrops",
  "category": "images",
  "type": "html",
  "version": "0.1.0",
  "tailwind": "^4.0.0",
  "tags": [
    "product",
    "plush",
    "toys",
    "grid"
  ],
  "files": [
    {
      "path": "image-plush-toy-set.html",
      "type": "html",
      "content": "<!--\n  Plush Toy Set — 1080×1080 JPEG from the HTML Library image set.\n  The width/height attributes reserve the box so the page does not shift\n  while the file downloads.\n-->\n<figure class=\"mx-auto w-full max-w-2xl\">\n  <img\n    src=\"https://xnsteam-ai.github.io/Html-library/images/2059273892318126496-1.jpg\"\n    alt=\"Four plush characters shot flat against clean backdrops\"\n    width=\"1080\"\n    height=\"1080\"\n    class=\"h-auto w-full rounded-xl\"\n  />\n  <figcaption class=\"mt-2 text-[12px] text-gray-600 dark:text-gray-400\">Plush Toy Set · 1080×1080</figcaption>\n</figure>\n"
    }
  ]
}
