{
  "$schema": "https://xnsteam-ai.github.io/Html-library/r/schema.json",
  "name": "image-idol-grid",
  "title": "Idol Grid",
  "description": "Six-frame idol photo set in a soft green wardrobe",
  "category": "images",
  "type": "html",
  "version": "0.1.0",
  "tailwind": "^4.0.0",
  "tags": [
    "grid",
    "idol",
    "green",
    "portrait"
  ],
  "files": [
    {
      "path": "image-idol-grid.html",
      "type": "html",
      "content": "<!--\n  Idol Grid — 1200×1200 JPEG from the HTML Library image set.\n  The width/height attributes reserve the box so the page does not shift\n  while the file downloads.\n-->\n<figure class=\"mx-auto w-full max-w-2xl\">\n  <img\n    src=\"https://xnsteam-ai.github.io/Html-library/images/2065277493066784984-1.jpg\"\n    alt=\"Six-frame idol photo set in a soft green wardrobe\"\n    width=\"1200\"\n    height=\"1200\"\n    class=\"h-auto w-full rounded-xl\"\n  />\n  <figcaption class=\"mt-2 text-[12px] text-gray-600 dark:text-gray-400\">Idol Grid · 1200×1200</figcaption>\n</figure>\n"
    }
  ]
}
