{
  "$schema": "https://xnsteam-ai.github.io/Html-library/r/schema.json",
  "name": "section-customer-stories",
  "title": "Customer Stories",
  "description": "A two-column case-study grid pairing a square brand-locked thumbnail with a headline, summary and inline link. Thumbnails are real photos.",
  "category": "sites",
  "type": "html",
  "version": "0.1.0",
  "tailwind": "^4.0.0",
  "tags": [
    "customers",
    "case study",
    "marketing",
    "grid"
  ],
  "surface": "section",
  "files": [
    {
      "path": "section-customer-stories.html",
      "type": "html",
      "content": "<!--\n  Customer Stories — a two-column grid of case-study cards.\n  Each thumbnail is a real photo hotlinked from Unsplash's permanent CDN.\n-->\n<section class=\"w-full bg-white py-20 lg:py-28 dark:bg-neutral-950\">\n  <div class=\"mx-auto w-full max-w-[1200px] px-6\">\n    <h2 class=\"mb-16 max-w-4xl text-[28px] font-normal leading-[1.2] tracking-tight text-gray-900 sm:text-[32px] lg:text-[40px] dark:text-gray-100\">\n      Runway is being used by the world's leading organizations\n      <br class=\"hidden sm:block\" />\n      across industries\n    </h2>\n\n    <div class=\"grid grid-cols-1 gap-x-12 gap-y-16 lg:grid-cols-2 xl:gap-x-20\">\n      <!-- Lionsgate -->\n      <article class=\"group flex flex-col gap-6 sm:flex-row lg:gap-8\">\n        <div class=\"relative aspect-square w-full shrink-0 overflow-hidden rounded-[20px] sm:w-[220px] md:w-[240px]\">\n          <img\n            src=\"https://images.unsplash.com/photo-1627133805065-5083466be4f7?q=80&w=600&auto=format&fit=crop\"\n            alt=\"Film set lighting rig\"\n            class=\"h-full w-full object-cover transition-transform duration-700 ease-out group-hover:scale-105\"\n          />\n          <div class=\"absolute inset-0 bg-black/30\"></div>\n          <div class=\"absolute inset-0 z-10 flex select-none items-center justify-center text-white\">\n            <span class=\"text-lg font-bold tracking-wide\">runway</span>\n            <span class=\"mx-3 font-light text-white/50\">/</span>\n            <span class=\"text-[17px] font-semibold uppercase tracking-widest\">Lionsgate</span>\n          </div>\n        </div>\n        <div class=\"flex flex-col pt-1\">\n          <h3 class=\"mb-2.5 text-[20px] font-medium leading-tight text-gray-900 lg:text-[22px] dark:text-gray-100\">\n            Runway Announces<br />Partnership with<br />Lionsgate\n          </h3>\n          <p class=\"mb-6 text-[15px] leading-snug text-gray-600 dark:text-muted-foreground\">\n            Runway and Lionsgate are partnering to explore the use of AI in film production.\n          </p>\n          <a href=\"#\" class=\"group/link mt-auto inline-flex items-center text-[13px] font-medium text-gray-900 transition-colors hover:text-gray-600 dark:text-gray-100 dark:hover:text-gray-400\">\n            Learn more\n            <svg class=\"ml-1.5 h-3.5 w-3.5 transition-transform group-hover/link:translate-x-1\" fill=\"none\" viewBox=\"0 0 24 24\" stroke=\"currentColor\" stroke-width=\"2\">\n              <path stroke-linecap=\"round\" stroke-linejoin=\"round\" d=\"M9 5l7 7-7 7\" />\n            </svg>\n          </a>\n        </div>\n      </article>\n\n      <!-- UCLA -->\n      <article class=\"group flex flex-col gap-6 sm:flex-row lg:gap-8\">\n        <div class=\"relative aspect-square w-full shrink-0 overflow-hidden rounded-[20px] sm:w-[220px] md:w-[240px]\">\n          <img\n            src=\"https://images.unsplash.com/photo-1556560957-9b6c2b102581?q=80&w=600&auto=format&fit=crop\"\n            alt=\"University campus building\"\n            class=\"h-full w-full object-cover transition-transform duration-700 ease-out group-hover:scale-105\"\n          />\n          <div class=\"absolute inset-0 bg-black/40\"></div>\n          <div class=\"absolute inset-0 z-10 flex select-none items-center justify-center text-white\">\n            <span class=\"text-lg font-bold tracking-wide\">runway</span>\n            <span class=\"mx-3 font-light text-white/50\">/</span>\n            <span class=\"text-xl font-semibold uppercase tracking-widest\">UCLA</span>\n          </div>\n        </div>\n        <div class=\"flex flex-col pt-1\">\n          <h3 class=\"mb-2.5 text-[20px] font-medium leading-tight text-gray-900 lg:text-[22px] dark:text-gray-100\">\n            UCLA's<br />Department of<br />Film, Television and<br />Digital Media\n          </h3>\n          <p class=\"mb-6 text-[15px] leading-snug text-gray-600 dark:text-muted-foreground\">\n            How UCLA's Film, Television and Digital Media program empowers students to experiment with AI in filmmaking.\n          </p>\n          <a href=\"#\" class=\"group/link mt-auto inline-flex items-center text-[13px] font-medium text-gray-900 transition-colors hover:text-gray-600 dark:text-gray-100 dark:hover:text-gray-400\">\n            Learn more\n            <svg class=\"ml-1.5 h-3.5 w-3.5 transition-transform group-hover/link:translate-x-1\" fill=\"none\" viewBox=\"0 0 24 24\" stroke=\"currentColor\" stroke-width=\"2\">\n              <path stroke-linecap=\"round\" stroke-linejoin=\"round\" d=\"M9 5l7 7-7 7\" />\n            </svg>\n          </a>\n        </div>\n      </article>\n\n      <!-- KPF -->\n      <article class=\"group flex flex-col gap-6 sm:flex-row lg:gap-8\">\n        <div class=\"relative aspect-square w-full shrink-0 overflow-hidden rounded-[20px] sm:w-[220px] md:w-[240px]\">\n          <img\n            src=\"https://images.unsplash.com/photo-1518005020951-eccb494ad742?q=80&w=600&auto=format&fit=crop\"\n            alt=\"Modern architecture facade\"\n            class=\"h-full w-full object-cover transition-transform duration-700 ease-out group-hover:scale-105\"\n          />\n          <div class=\"absolute inset-0 bg-black/30\"></div>\n          <div class=\"absolute inset-0 z-10 flex select-none items-center justify-center text-white\">\n            <span class=\"text-lg font-bold tracking-wide\">runway</span>\n            <span class=\"mx-3 font-light text-white/50\">/</span>\n            <span class=\"font-serif text-2xl tracking-wide\">KPF</span>\n          </div>\n        </div>\n        <div class=\"flex flex-col pt-1\">\n          <h3 class=\"mb-2.5 text-[20px] font-medium leading-tight text-gray-900 lg:text-[22px] dark:text-gray-100\">\n            How KPF is<br />incorporating AI<br />into Architectural<br />workflows\n          </h3>\n          <p class=\"mb-6 text-[15px] leading-snug text-gray-600 dark:text-muted-foreground\">\n            How KPF is using Runway to streamline rendering workflows and empower creatives to animate architectural projects in-house.\n          </p>\n          <a href=\"#\" class=\"group/link mt-auto inline-flex items-center text-[13px] font-medium text-gray-900 transition-colors hover:text-gray-600 dark:text-gray-100 dark:hover:text-gray-400\">\n            Learn more\n            <svg class=\"ml-1.5 h-3.5 w-3.5 transition-transform group-hover/link:translate-x-1\" fill=\"none\" viewBox=\"0 0 24 24\" stroke=\"currentColor\" stroke-width=\"2\">\n              <path stroke-linecap=\"round\" stroke-linejoin=\"round\" d=\"M9 5l7 7-7 7\" />\n            </svg>\n          </a>\n        </div>\n      </article>\n\n      <!-- House of David -->\n      <article class=\"group flex flex-col gap-6 sm:flex-row lg:gap-8\">\n        <div class=\"relative aspect-square w-full shrink-0 overflow-hidden rounded-[20px] sm:w-[220px] md:w-[240px]\">\n          <img\n            src=\"https://images.unsplash.com/photo-1556305896-c4bbbf66eb03?q=80&w=600&auto=format&fit=crop\"\n            alt=\"Desert caravan at dusk\"\n            class=\"h-full w-full object-cover transition-transform duration-700 ease-out group-hover:scale-105\"\n          />\n          <div class=\"absolute inset-0 bg-black/40\"></div>\n          <div class=\"absolute inset-0 z-10 flex select-none items-center justify-center text-white\">\n            <span class=\"text-lg font-bold tracking-wide\">runway</span>\n            <span class=\"mx-3 font-light text-white/50\">/</span>\n            <span class=\"flex flex-col items-center justify-center\">\n              <span class=\"mb-[-4px] text-[8px] uppercase tracking-[0.2em] opacity-80\">House</span>\n              <span class=\"font-serif text-[22px] tracking-wide\">DAVID</span>\n            </span>\n          </div>\n        </div>\n        <div class=\"flex flex-col pt-1\">\n          <h3 class=\"mb-2.5 text-[20px] font-medium leading-tight text-gray-900 lg:text-[22px] dark:text-gray-100\">\n            Case study: House<br />of David\n          </h3>\n          <p class=\"mb-6 text-[15px] leading-snug text-gray-600 dark:text-muted-foreground\">\n            How “House of David” used Runway to become Amazon's latest hit series.\n          </p>\n          <a href=\"#\" class=\"group/link mt-auto inline-flex items-center text-[13px] font-medium text-gray-900 transition-colors hover:text-gray-600 dark:text-gray-100 dark:hover:text-gray-400\">\n            Learn more\n            <svg class=\"ml-1.5 h-3.5 w-3.5 transition-transform group-hover/link:translate-x-1\" fill=\"none\" viewBox=\"0 0 24 24\" stroke=\"currentColor\" stroke-width=\"2\">\n              <path stroke-linecap=\"round\" stroke-linejoin=\"round\" d=\"M9 5l7 7-7 7\" />\n            </svg>\n          </a>\n        </div>\n      </article>\n    </div>\n  </div>\n</section>\n"
    }
  ]
}
