{
  "$schema": "https://xnsteam-ai.github.io/Html-library/r/schema.json",
  "name": "image-car-lean-portrait",
  "title": "Car Lean Portrait",
  "description": "Portrait leaning against a car under an overcast sky",
  "category": "images",
  "type": "html",
  "version": "0.1.0",
  "tailwind": "^4.0.0",
  "tags": [
    "portrait",
    "automotive",
    "lifestyle",
    "moody"
  ],
  "files": [
    {
      "path": "image-car-lean-portrait.html",
      "type": "html",
      "content": "<!--\n  Car Lean Portrait — 896×1200 JPEG from the HTML Library image set.\n  The width/height attributes reserve the box so the page does not shift\n  while the file downloads.\n-->\n<figure class=\"mx-auto w-full max-w-2xl\">\n  <img\n    src=\"https://xnsteam-ai.github.io/Html-library/images/2074823307292229688-1.jpg\"\n    alt=\"Portrait leaning against a car under an overcast sky\"\n    width=\"896\"\n    height=\"1200\"\n    class=\"h-auto w-full rounded-xl\"\n  />\n  <figcaption class=\"mt-2 text-[12px] text-gray-600\">Car Lean Portrait · 896×1200</figcaption>\n</figure>\n"
    }
  ]
}
