{
  "$schema": "https://xnsteam-ai.github.io/Html-library/r/schema.json",
  "name": "image-backlit-warehouse-portrait",
  "title": "Backlit Warehouse Portrait",
  "description": "Moody portrait backlit inside an industrial warehouse space",
  "category": "images",
  "type": "html",
  "version": "0.1.0",
  "tailwind": "^4.0.0",
  "tags": [
    "portrait",
    "moody",
    "industrial",
    "cinematic"
  ],
  "files": [
    {
      "path": "image-backlit-warehouse-portrait.html",
      "type": "html",
      "content": "<!--\n  Backlit Warehouse Portrait — 896×1200 JPEG from the HTML Library image set.\n  The width/height attributes reserve the box so the page does not shift\n  while the file downloads.\n-->\n<figure class=\"mx-auto w-full max-w-2xl\">\n  <img\n    src=\"https://xnsteam-ai.github.io/Html-library/images/2032013831548125557-1.jpg\"\n    alt=\"Moody portrait backlit inside an industrial warehouse space\"\n    width=\"896\"\n    height=\"1200\"\n    class=\"h-auto w-full rounded-xl\"\n  />\n  <figcaption class=\"mt-2 text-[12px] text-gray-600\">Backlit Warehouse Portrait · 896×1200</figcaption>\n</figure>\n"
    }
  ]
}
